{
  "schema_version": "1.0.0",
  "label_schema_version": "1.0.0",
  "source_ocr_schema_version": "1.0.0",
  "document_id": "synthetic-invoice-001",
  "pages": [
    {
      "page_index": 0,
      "image_width": 1000,
      "image_height": 1400,
      "tokens": [
        {
          "token_index": 0,
          "text": "Example",
          "bounding_box": {"x_min": 20, "y_min": 20, "x_max": 100, "y_max": 40},
          "label": "B-SELLER_NAME"
        },
        {
          "token_index": 1,
          "text": "Supplies",
          "bounding_box": {"x_min": 110, "y_min": 20, "x_max": 200, "y_max": 40},
          "label": "I-SELLER_NAME"
        },
        {
          "token_index": 2,
          "text": "Invoice",
          "bounding_box": {"x_min": 20, "y_min": 80, "x_max": 90, "y_max": 100},
          "label": "O"
        },
        {
          "token_index": 3,
          "text": "INV-001",
          "bounding_box": {"x_min": 100, "y_min": 80, "x_max": 190, "y_max": 100},
          "label": "B-INVOICE_NUMBER"
        }
      ]
    }
  ]
}
